Labirinto del Castello di Atlante#All'interno delle mura maestose del castello di Atlante, ti svegli senza memoria, intrappolato in un labirinto di inganni e illusioni, mentre cerchi disperatamente di ritrovare il tuo passato.#  #131104
Battaglia nella Foresta di Ardennes#Nella cupa foresta di Ardennes, ti ritrovi a fronteggiare un esercito di creature demoniache, mentre cerchi di proteggere la tua amata Angelica dalle grinfie di un oscuro incantesimo.# #786560
Vendetta nelle Pianure Spagnole #Nelle pianure bruciate dal sole della Spagna, cavalchi con furore, determinato a vendicare l'onore della tua famiglia, mentre le ombre del tradimento e delle recenti mosse politiche si addensano intorno a te.# #256
Inganno sul Lago di Garda#Sulle rive tranquille del Lago di Garda, ti imbatti in una festa sfarzosa organizzata dalla maga Alcina, nella quale l'inganno e la seduzione sono moneta corrente a causa delle sue arti malefiche.# #532480
Intrighi a Parigi#Tra le torri maestose della città di Parigi, ti ritrovi coinvolto in una guerra segreta tra fazioni rivali, dove l'amore e l'ambizione si intrecciano in un labirinto di intrighi e tradimenti.# #262152
Caccia al Tesoro nel Mediterraneo#Sulle acque tempestose del Mediterraneo, navighi a bordo di una nave fantasma maledetta, alla ricerca di un tesoro perduto e di redenzione per le tue colpe passate.# #4096
La Fuga di Angelica#Angelica si trova a fungere da premio di guerra tra due contendenti che se ne sono innamorati follemente, ma lei, regina delle arti oscure, dopo aver appreso la notizia, decide di distruggere la torre nella quale era imprigionata e scappare in Sicilia.# #32
Ombre di Guerra#Le terre del regno sono immerse nell’agitazione e nell’incertezza. Ti destreggi tra le fiamme della guerra e gli inganni dei tuoi nemici. Mentre il sole sorge all’orizzonte, le prime ombre si allungano sui campi di battaglia, annunciando un conflitto imminente.#  #262400
La Follia del Re Turco#Il mago Atlante, custode della fiamma del drago, sbaglia incantesimo e fa perdere la ragione al re turco, il quale decide di far scoppiare una serie di guerre in Europa. Tuttavia, non ha idea dei pericoli in cui si sta mettendo.# #131072
